{
  "$schema": "https://json-schema.org/draft/2020-12/schema",
  "$id": "https://raw.githubusercontent.com/fellowAI2025/7d24h-templates/main/schemas/typage-template.v1.schema.json",
  "title": "typage.json (typage-template/v1)",
  "description": "Generated by tools/schemas.mjs from tools/lib/schema.mjs; do not edit.",
  "type": "object",
  "properties": {
    "schema": {
      "enum": [
        "typage-template/v1"
      ]
    },
    "kind": {
      "enum": [
        "official",
        "general",
        "thesis",
        "style-like"
      ]
    },
    "venue": {
      "type": [
        "object",
        "null"
      ],
      "properties": {
        "profileId": {
          "type": [
            "string",
            "null"
          ],
          "minLength": 1,
          "maxLength": 63,
          "pattern": "^[a-z][a-z0-9-]{1,62}$"
        },
        "label": {
          "type": "string",
          "minLength": 1,
          "maxLength": 80
        },
        "labelZh": {
          "type": "string",
          "minLength": 1,
          "maxLength": 80
        }
      },
      "required": [
        "profileId",
        "label",
        "labelZh"
      ],
      "additionalProperties": false
    },
    "entry": {
      "type": "string",
      "minLength": 1,
      "maxLength": 240,
      "pattern": "^(?!\\/)(?!.*(?:^|\\/)\\.\\.?(?:\\/|$))[A-Za-z0-9_\\-./]+$"
    },
    "engine": {
      "type": "object",
      "properties": {
        "policy": {
          "enum": [
            "tectonic-only",
            "system-tex-allowed"
          ]
        },
        "compiler": {
          "enum": [
            "tectonic",
            "xelatex",
            "lualatex",
            "pdflatex"
          ]
        },
        "bundle": {
          "enum": [
            "v33",
            null
          ]
        },
        "biber": {
          "enum": [
            "2.17",
            null
          ]
        }
      },
      "required": [
        "policy",
        "compiler",
        "bundle",
        "biber"
      ],
      "additionalProperties": false
    },
    "officialFiles": {
      "type": "array",
      "items": {
        "type": "object",
        "properties": {
          "path": {
            "type": "string",
            "minLength": 1,
            "maxLength": 240,
            "pattern": "^(?!\\/)(?!.*(?:^|\\/)\\.\\.?(?:\\/|$))[A-Za-z0-9_\\-./]+$"
          },
          "inBundle": {
            "type": "boolean"
          },
          "sha256": {
            "type": "string",
            "minLength": 1,
            "maxLength": 64,
            "pattern": "^[0-9a-f]{64}$"
          },
          "officialUrl": {
            "type": "string",
            "minLength": 1,
            "maxLength": 400,
            "pattern": "^https:\\/\\/[^\\s]+$"
          },
          "officialVersion": {
            "type": "string",
            "minLength": 1,
            "maxLength": 80
          }
        },
        "required": [
          "path",
          "inBundle",
          "sha256",
          "officialUrl",
          "officialVersion"
        ],
        "additionalProperties": false
      },
      "maxItems": 200
    },
    "templateRegion": {
      "type": "object",
      "properties": {
        "documentClass": {
          "type": "string",
          "minLength": 1,
          "maxLength": 60,
          "pattern": "^[A-Za-z0-9-]+$"
        },
        "ownedPackages": {
          "type": "array",
          "items": {
            "type": "string",
            "minLength": 1,
            "maxLength": 60,
            "pattern": "^[A-Za-z0-9-]+$"
          },
          "maxItems": 60
        },
        "ownedCommands": {
          "type": "array",
          "items": {
            "type": "string",
            "minLength": 1,
            "maxLength": 60,
            "pattern": "^\\\\[A-Za-z@]+\\*?$"
          },
          "maxItems": 60
        }
      },
      "required": [
        "documentClass",
        "ownedPackages",
        "ownedCommands"
      ],
      "additionalProperties": false
    },
    "variants": {
      "type": "array",
      "items": {
        "type": "object",
        "properties": {
          "id": {
            "type": "string",
            "minLength": 1,
            "maxLength": 40,
            "pattern": "^[a-z][a-z0-9-]{1,62}$"
          },
          "label": {
            "type": "string",
            "minLength": 1,
            "maxLength": 60
          },
          "labelZh": {
            "type": "string",
            "minLength": 1,
            "maxLength": 60
          },
          "classOptions": {
            "type": "array",
            "items": {
              "type": "string",
              "minLength": 1,
              "maxLength": 60,
              "pattern": "^[A-Za-z0-9=.,_-]+$"
            },
            "maxItems": 20
          }
        },
        "required": [
          "id",
          "label",
          "labelZh",
          "classOptions"
        ],
        "additionalProperties": false
      },
      "maxItems": 12
    },
    "frontMatter": {
      "type": "object",
      "properties": {
        "serializer": {
          "enum": [
            "generic",
            "acmart",
            "ieeetran",
            "llncs",
            "elsarticle",
            "revtex",
            "ctex-thesis",
            "beamer",
            "cv"
          ]
        },
        "fields": {
          "type": "array",
          "items": {
            "enum": [
              "title",
              "subtitle",
              "authors",
              "affiliations",
              "emails",
              "abstract",
              "keywords",
              "ccs",
              "date",
              "thanks"
            ]
          },
          "maxItems": 10
        }
      },
      "required": [
        "serializer",
        "fields"
      ],
      "additionalProperties": false
    },
    "bibliography": {
      "type": "object",
      "properties": {
        "system": {
          "enum": [
            "bibtex",
            "biblatex",
            "none"
          ]
        },
        "style": {
          "type": [
            "string",
            "null"
          ],
          "minLength": 1,
          "maxLength": 80,
          "pattern": "^[A-Za-z0-9_-]+$"
        },
        "citation": {
          "enum": [
            "numeric",
            "author-year",
            "none"
          ]
        },
        "citeCommands": {
          "type": "object",
          "propertyNames": {
            "type": "string",
            "minLength": 1,
            "maxLength": 40,
            "pattern": "^\\\\[A-Za-z@]+\\*?$"
          },
          "additionalProperties": {
            "type": "string",
            "minLength": 1,
            "maxLength": 40,
            "pattern": "^\\\\[A-Za-z@]+\\*?$"
          },
          "maxProperties": 20
        }
      },
      "required": [
        "system",
        "style",
        "citation",
        "citeCommands"
      ],
      "additionalProperties": false
    },
    "classCommands": {
      "type": "array",
      "items": {
        "type": "object",
        "properties": {
          "command": {
            "type": "string",
            "minLength": 1,
            "maxLength": 60,
            "pattern": "^\\\\[A-Za-z@]+\\*?$"
          },
          "to": {
            "type": [
              "string",
              "null"
            ],
            "minLength": 1,
            "maxLength": 60,
            "pattern": "^\\\\[A-Za-z@]+\\*?$"
          }
        },
        "required": [
          "command",
          "to"
        ],
        "additionalProperties": false
      },
      "maxItems": 60
    },
    "requirements": {
      "type": [
        "object",
        "null"
      ],
      "properties": {
        "pageLimit": {
          "type": [
            "integer",
            "null"
          ],
          "minimum": 1,
          "maximum": 1000
        },
        "anonymous": {
          "type": "boolean"
        }
      },
      "required": [
        "pageLimit",
        "anonymous"
      ],
      "additionalProperties": false
    },
    "visualTheme": {
      "type": [
        "object",
        "null"
      ],
      "properties": {
        "fontFamily": {
          "type": "string",
          "minLength": 1,
          "maxLength": 80
        },
        "baseSizePt": {
          "type": "number",
          "minimum": 6,
          "maximum": 20
        },
        "lineSpread": {
          "type": "number",
          "minimum": 0.8,
          "maximum": 3
        },
        "paper": {
          "enum": [
            "a4",
            "letter"
          ]
        }
      },
      "required": [
        "fontFamily",
        "baseSizePt",
        "lineSpread",
        "paper"
      ],
      "additionalProperties": false
    },
    "roles": {
      "type": "object",
      "propertyNames": {
        "type": "string",
        "minLength": 1,
        "maxLength": 240,
        "pattern": "^(?!\\/)(?!.*(?:^|\\/)\\.\\.?(?:\\/|$))[A-Za-z0-9_\\-./]+$"
      },
      "additionalProperties": {
        "enum": [
          "sample",
          "class",
          "style",
          "bst",
          "bib",
          "figure",
          "font",
          "support"
        ]
      },
      "maxProperties": 1500
    },
    "verified": {
      "type": [
        "object",
        "null"
      ],
      "properties": {
        "compiler": {
          "type": "string",
          "minLength": 1,
          "maxLength": 80
        },
        "systemTex": {
          "type": "boolean"
        },
        "officialFilesMatch": {
          "type": [
            "boolean",
            "null"
          ]
        },
        "pages": {
          "type": "integer",
          "minimum": 1,
          "maximum": 5000
        },
        "visualRaw": {
          "type": [
            "integer",
            "null"
          ],
          "minimum": 0,
          "maximum": 100000
        },
        "fieldsDetected": {
          "type": [
            "integer",
            "null"
          ],
          "minimum": 0,
          "maximum": 100
        },
        "at": {
          "type": "string",
          "minLength": 1,
          "maxLength": 40,
          "pattern": "^\\d{4}-\\d{2}-\\d{2}T\\d{2}:\\d{2}:\\d{2}(?:\\.\\d+)?Z$"
        },
        "by": {
          "type": "string",
          "minLength": 1,
          "maxLength": 80
        }
      },
      "required": [
        "compiler",
        "systemTex",
        "officialFilesMatch",
        "pages",
        "visualRaw",
        "fieldsDetected",
        "at",
        "by"
      ],
      "additionalProperties": false
    }
  },
  "required": [
    "schema",
    "kind",
    "venue",
    "entry",
    "engine",
    "officialFiles",
    "templateRegion",
    "variants",
    "frontMatter",
    "bibliography",
    "classCommands",
    "requirements",
    "visualTheme",
    "roles",
    "verified"
  ],
  "additionalProperties": false
}
