{
  "schema": "typage-template/v1",
  "kind": "general",
  "venue": null,
  "entry": "main.tex",
  "engine": {
    "policy": "tectonic-only",
    "compiler": "tectonic",
    "bundle": "v33",
    "biber": null
  },
  "officialFiles": [],
  "templateRegion": {
    "documentClass": "article",
    "ownedPackages": [
      "fontspec",
      "geometry",
      "enumitem"
    ],
    "ownedCommands": [
      "\\setlist",
      "\\setlength"
    ]
  },
  "variants": [
    {
      "id": "a4",
      "label": "A4",
      "labelZh": "A4",
      "classOptions": [
        "11pt",
        "a4paper"
      ]
    },
    {
      "id": "letter",
      "label": "US Letter",
      "labelZh": "US Letter",
      "classOptions": [
        "11pt",
        "letterpaper"
      ]
    }
  ],
  "frontMatter": {
    "serializer": "cv",
    "fields": [
      "authors",
      "affiliations",
      "emails"
    ]
  },
  "bibliography": {
    "system": "none",
    "style": null,
    "citation": "none",
    "citeCommands": {}
  },
  "classCommands": [],
  "requirements": null,
  "visualTheme": {
    "fontFamily": "Latin Modern Roman",
    "baseSizePt": 11,
    "lineSpread": 1,
    "paper": "a4"
  },
  "roles": {
    "main.tex": "sample"
  },
  "verified": {
    "compiler": "tectonic 0.17.0 / bundle v33",
    "systemTex": false,
    "officialFilesMatch": null,
    "pages": 1,
    "visualRaw": null,
    "fieldsDetected": null,
    "at": "2026-10-30T10:49:48Z",
    "by": "7d24h-templates/tools 1.0.0"
  }
}
