{
  "schema": "typage-template/v1",
  "kind": "official",
  "venue": {
    "profileId": null,
    "label": "Springer LNCS",
    "labelZh": "Springer LNCS"
  },
  "entry": "main.tex",
  "engine": {
    "policy": "tectonic-only",
    "compiler": "tectonic",
    "bundle": "v33",
    "biber": null
  },
  "officialFiles": [
    {
      "path": "llncs.cls",
      "inBundle": false,
      "sha256": "e9894c92191fcd195eef3120a36d2f75b52030eadcbdc3ce1463179746526e6a",
      "officialUrl": "https://mirrors.ctan.org/macros/latex/contrib/llncs/llncs.cls",
      "officialVersion": "2.26 (2025-02-25)"
    },
    {
      "path": "splncs04.bst",
      "inBundle": false,
      "sha256": "f36c3a17e5304a692706359aafa9de709395a085e579eb47c027095aeaa35174",
      "officialUrl": "https://mirrors.ctan.org/macros/latex/contrib/llncs/splncs04.bst",
      "officialVersion": "llncs 2.26 (2025-02-25)"
    }
  ],
  "templateRegion": {
    "documentClass": "llncs",
    "ownedPackages": [],
    "ownedCommands": [
      "\\bibliographystyle"
    ]
  },
  "variants": [
    {
      "id": "runningheads",
      "label": "With running heads",
      "labelZh": "带页眉",
      "classOptions": [
        "runningheads"
      ]
    },
    {
      "id": "plain",
      "label": "Without running heads",
      "labelZh": "不带页眉",
      "classOptions": []
    }
  ],
  "frontMatter": {
    "serializer": "llncs",
    "fields": [
      "title",
      "thanks",
      "authors",
      "affiliations",
      "emails",
      "abstract",
      "keywords"
    ]
  },
  "bibliography": {
    "system": "bibtex",
    "style": "splncs04",
    "citation": "numeric",
    "citeCommands": {}
  },
  "classCommands": [
    {
      "command": "\\inst",
      "to": null
    },
    {
      "command": "\\institute",
      "to": null
    },
    {
      "command": "\\authorrunning",
      "to": null
    },
    {
      "command": "\\titlerunning",
      "to": null
    },
    {
      "command": "\\email",
      "to": null
    },
    {
      "command": "\\keywords",
      "to": null
    },
    {
      "command": "\\orcidID",
      "to": null
    }
  ],
  "requirements": null,
  "visualTheme": {
    "fontFamily": "Computer Modern",
    "baseSizePt": 10,
    "lineSpread": 1,
    "paper": "a4"
  },
  "roles": {
    "main.tex": "sample",
    "refs.bib": "bib",
    "llncs.cls": "class",
    "splncs04.bst": "bst"
  },
  "verified": {
    "compiler": "tectonic 0.17.0 / bundle v33",
    "systemTex": false,
    "officialFilesMatch": true,
    "pages": 2,
    "visualRaw": null,
    "fieldsDetected": null,
    "at": "2026-10-30T10:49:15Z",
    "by": "7d24h-templates/tools 1.0.0"
  }
}
